{
 "actual": {
  "actor": "p_047",
  "kind": "pass",
  "policy_prob": 0.0901,
  "target": "p_025"
 },
 "alternative": {
  "actor": "p_047",
  "kind": "carry",
  "policy_prob": 0.0972,
  "target": "e"
 },
 "alternative_outcome": {
  "ci95_win_prob_home": [
   0.2743,
   0.2752
  ],
  "mean_xt_gain": 0.00244,
  "p_goal_away": 0.0004,
  "p_goal_home": 0.0024,
  "shots_away": 0.0,
  "shots_home": 0.005,
  "win_prob_home": 0.2748
 },
 "baseline": {
  "ci95_win_prob_home": [
   0.2748,
   0.277
  ],
  "mean_xt_gain": 0.00179,
  "p_goal_away": 0.0002,
  "p_goal_home": 0.0051,
  "shots_away": 0.0,
  "shots_home": 0.05,
  "win_prob_home": 0.2759
 },
 "compute_ms": 1311,
 "counterfactual_id": "cf_000106",
 "delta_win_prob_home": -0.0012,
 "engine": "scripted_v1",
 "engine_hash": "d9e1bf248ee8796443a01c80d39e68dab9fdc21b",
 "evidence_event_ids": [
  "e_1838"
 ],
 "futures_sample": [
  [
   [
    42.62,
    57.44
   ],
   [
    33.05,
    48.64
   ],
   [
    21.71,
    38.3
   ],
   [
    14.11,
    31.17
   ],
   [
    16.79,
    31.26
   ],
   [
    22.27,
    35.54
   ],
   [
    32.69,
    47.57
   ],
   [
    41.6,
    57.86
   ],
   [
    37.88,
    53.56
   ]
  ],
  [
   [
    42.62,
    57.44
   ],
   [
    47.21,
    46.43
   ],
   [
    52.74,
    31.53
   ],
   [
    57.34,
    19.13
   ],
   [
    59.28,
    22.3
   ],
   [
    61.85,
    22.13
   ],
   [
    59.2,
    23.12
   ],
   [
    56.1,
    23.22
   ],
   [
    54.88,
    24.04
   ]
  ],
  [
   [
    42.62,
    57.44
   ],
   [
    34.29,
    53.32
   ],
   [
    20.16,
    46.53
   ],
   [
    8.72,
    41.04
   ],
   [
    8.13,
    40.95
   ],
   [
    11.28,
    40.51
   ],
   [
    27.4,
    40.22
   ],
   [
    41.55,
    39.97
   ],
   [
    46.47,
    39.38
   ]
  ],
  [
   [
    42.62,
    57.44
   ],
   [
    34.35,
    53.97
   ],
   [
    28.47,
    51.71
   ],
   [
    27.18,
    41.46
   ],
   [
    26.36,
    37.08
   ],
   [
    25.2,
    22.45
   ],
   [
    23.91,
    13.69
   ],
   [
    18.71,
    19.91
   ],
   [
    10.67,
    29.85
   ]
  ],
  [
   [
    42.62,
    57.44
   ],
   [
    42.83,
    56.73
   ],
   [
    40.41,
    55.4
   ],
   [
    37.45,
    44.64
   ],
   [
    35.32,
    39.12
   ],
   [
    33.36,
    37.35
   ],
   [
    30.92,
    35.97
   ],
   [
    28.22,
    35.22
   ],
   [
    25.74,
    34.09
   ]
  ],
  [
   [
    42.62,
    57.44
   ],
   [
    45.46,
    57.81
   ],
   [
    48.24,
    57.45
   ],
   [
    51.0,
    42.63
   ],
   [
    54.02,
    27.36
   ],
   [
    56.84,
    15.87
   ],
   [
    59.1,
    17.09
   ],
   [
    63.01,
    17.2
   ],
   [
    66.98,
    17.7
   ]
  ],
  [
   [
    42.62,
    57.44
   ],
   [
    45.46,
    57.81
   ],
   [
    48.24,
    57.45
   ],
   [
    33.75,
    63.24
   ],
   [
    24.21,
    66.94
   ],
   [
    35.49,
    55.41
   ],
   [
    45.59,
    45.64
   ],
   [
    48.96,
    44.45
   ],
   [
    51.01,
    43.96
   ]
  ],
  [
   [
    42.62,
    57.44
   ],
   [
    45.46,
    57.81
   ],
   [
    48.24,
    57.45
   ],
   [
    53.7,
    50.06
   ],
   [
    58.67,
    41.8
   ],
   [
    59.29,
    40.77
   ],
   [
    59.08,
    40.29
   ],
   [
    59.08,
    40.29
   ],
   [
    59.08,
    40.29
   ]
  ],
  [
   [
    42.62,
    57.44
   ],
   [
    41.51,
    56.6
   ],
   [
    38.76,
    54.9
   ],
   [
    35.48,
    52.86
   ],
   [
    31.23,
    47.22
   ],
   [
    25.43,
    40.56
   ],
   [
    23.03,
    30.24
   ],
   [
    23.23,
    35.11
   ],
   [
    23.36,
    37.12
   ]
  ],
  [
   [
    42.62,
    57.44
   ],
   [
    45.46,
    57.81
   ],
   [
    48.24,
    57.45
   ],
   [
    51.7,
    56.83
   ],
   [
    52.24,
    58.07
   ],
   [
    38.26,
    63.47
   ],
   [
    30.17,
    66.59
   ],
   [
    32.02,
    63.88
   ],
   [
    40.34,
    64.88
   ]
  ],
  [
   [
    42.62,
    57.44
   ],
   [
    44.85,
    47.87
   ],
   [
    46.63,
    39.53
   ],
   [
    32.64,
    42.39
   ],
   [
    21.81,
    44.4
   ],
   [
    17.28,
    45.38
   ],
   [
    27.47,
    53.2
   ],
   [
    37.7,
    61.69
   ],
   [
    43.06,
    66.14
   ]
  ],
  [
   [
    42.62,
    57.44
   ],
   [
    45.46,
    57.81
   ],
   [
    48.24,
    57.45
   ],
   [
    45.95,
    49.93
   ],
   [
    39.42,
    36.27
   ],
   [
    37.77,
    30.36
   ],
   [
    50.15,
    35.41
   ],
   [
    56.48,
    32.77
   ],
   [
    67.17,
    27.57
   ]
  ],
  [
   [
    42.62,
    57.44
   ],
   [
    45.46,
    57.81
   ],
   [
    48.24,
    57.45
   ],
   [
    51.7,
    56.83
   ],
   [
    53.31,
    55.42
   ],
   [
    58.84,
    45.94
   ],
   [
    66.71,
    31.85
   ],
   [
    73.72,
    19.29
   ],
   [
    77.01,
    13.29
   ]
  ],
  [
   [
    42.62,
    57.44
   ],
   [
    34.23,
    48.82
   ],
   [
    25.21,
    39.64
   ],
   [
    25.26,
    37.47
   ],
   [
    29.87,
    40.54
   ],
   [
    39.84,
    53.47
   ],
   [
    44.74,
    59.9
   ],
   [
    34.27,
    56.82
   ],
   [
    20.44,
    53.13
   ]
  ],
  [
   [
    42.62,
    57.44
   ],
   [
    45.46,
    57.81
   ],
   [
    48.24,
    57.45
   ],
   [
    48.0,
    56.86
   ],
   [
    44.94,
    47.47
   ],
   [
    42.53,
    40.34
   ],
   [
    39.94,
    39.47
   ],
   [
    39.33,
    39.3
   ],
   [
    41.54,
    39.47
   ]
  ],
  [
   [
    42.62,
    57.44
   ],
   [
    45.11,
    47.92
   ],
   [
    46.97,
    39.77
   ],
   [
    49.22,
    40.81
   ],
   [
    52.01,
    41.26
   ],
   [
    54.81,
    41.26
   ],
   [
    60.18,
    32.59
   ],
   [
    67.52,
    19.1
   ],
   [
    72.65,
    13.01
   ]
  ],
  [
   [
    42.62,
    57.44
   ],
   [
    40.97,
    56.26
   ],
   [
    37.97,
    54.55
   ],
   [
    34.87,
    52.46
   ],
   [
    29.75,
    42.58
   ],
   [
    27.65,
    38.89
   ],
   [
    23.45,
    37.65
   ],
   [
    9.36,
    35.69
   ],
   [
    6.2,
    34.73
   ]
  ],
  [
   [
    42.62,
    57.44
   ],
   [
    45.46,
    57.81
   ],
   [
    39.17,
    45.72
   ],
   [
    31.73,
    31.69
   ],
   [
    29.67,
    27.29
   ],
   [
    31.91,
    28.65
   ],
   [
    31.57,
    27.58
   ],
   [
    28.41,
    31.98
   ],
   [
    24.05,
    34.06
   ]
  ],
  [
   [
    42.62,
    57.44
   ],
   [
    32.42,
    52.88
   ],
   [
    18.21,
    46.59
   ],
   [
    7.05,
    41.64
   ],
   [
    8.12,
    40.94
   ],
   [
    8.12,
    40.94
   ],
   [
    8.12,
    40.94
   ],
   [
    11.26,
    40.45
   ],
   [
    27.36,
    39.96
   ]
  ],
  [
   [
    42.62,
    57.44
   ],
   [
    45.46,
    57.81
   ],
   [
    48.24,
    57.45
   ],
   [
    51.7,
    56.83
   ],
   [
    47.65,
    56.11
   ],
   [
    38.04,
    53.76
   ],
   [
    42.3,
    44.18
   ],
   [
    49.06,
    29.85
   ],
   [
    54.68,
    17.92
   ]
  ],
  [
   [
    42.62,
    57.44
   ],
   [
    41.95,
    56.76
   ],
   [
    40.73,
    49.16
   ],
   [
    40.07,
    33.08
   ],
   [
    39.49,
    18.97
   ],
   [
    38.52,
    15.65
   ],
   [
    35.19,
    17.31
   ],
   [
    41.94,
    30.25
   ],
   [
    47.62,
    39.93
   ]
  ],
  [
   [
    42.62,
    57.44
   ],
   [
    45.46,
    57.81
   ],
   [
    48.24,
    57.45
   ],
   [
    51.7,
    56.83
   ],
   [
    56.53,
    43.02
   ],
   [
    59.29,
    33.51
   ],
   [
    61.38,
    37.01
   ],
   [
    66.03,
    50.06
   ],
   [
    69.91,
    38.12
   ]
  ],
  [
   [
    42.62,
    57.44
   ],
   [
    29.05,
    53.23
   ],
   [
    18.34,
    49.88
   ],
   [
    13.95,
    48.2
   ],
   [
    17.29,
    47.48
   ],
   [
    21.66,
    45.19
   ],
   [
    36.15,
    40.53
   ],
   [
    44.64,
    37.89
   ],
   [
    39.74,
    42.17
   ]
  ],
  [
   [
    42.62,
    57.44
   ],
   [
    45.46,
    57.81
   ],
   [
    48.24,
    57.45
   ],
   [
    51.7,
    56.83
   ],
   [
    42.22,
    61.12
   ],
   [
    30.02,
    66.14
   ],
   [
    32.9,
    61.2
   ],
   [
    42.78,
    49.61
   ],
   [
    47.79,
    43.9
   ]
  ],
  [
   [
    42.62,
    57.44
   ],
   [
    45.46,
    57.81
   ],
   [
    38.08,
    50.52
   ],
   [
    28.46,
    41.56
   ],
   [
    28.38,
    40.28
   ],
   [
    29.83,
    27.79
   ],
   [
    29.65,
    21.63
   ],
   [
    37.73,
    21.79
   ],
   [
    54.65,
    22.52
   ]
  ],
  [
   [
    42.62,
    57.44
   ],
   [
    28.42,
    62.07
   ],
   [
    19.2,
    64.99
   ],
   [
    27.16,
    57.63
   ],
   [
    38.93,
    47.9
   ],
   [
    44.65,
    43.99
   ],
   [
    45.5,
    58.21
   ],
   [
    46.62,
    62.02
   ],
   [
    33.98,
    55.89
   ]
  ],
  [
   [
    42.62,
    57.44
   ],
   [
    37.21,
    55.45
   ],
   [
    29.88,
    52.88
   ],
   [
    28.13,
    41.89
   ],
   [
    27.33,
    37.39
   ],
   [
    32.11,
    36.19
   ],
   [
    40.95,
    32.56
   ],
   [
    42.43,
    20.93
   ],
   [
    43.41,
    16.39
   ]
  ],
  [
   [
    42.62,
    57.44
   ],
   [
    32.82,
    47.78
   ],
   [
    23.69,
    38.63
   ],
   [
    24.51,
    39.49
   ],
   [
    37.65,
    44.7
   ],
   [
    35.84,
    44.38
   ],
   [
    23.02,
    39.04
   ],
   [
    19.72,
    37.8
   ],
   [
    16.99,
    37.22
   ]
  ],
  [
   [
    42.62,
    57.44
   ],
   [
    47.84,
    46.69
   ],
   [
    54.22,
    32.13
   ],
   [
    59.52,
    20.01
   ],
   [
    62.91,
    12.29
   ],
   [
    64.42,
    8.82
   ],
   [
    65.14,
    7.19
   ],
   [
    65.46,
    6.93
   ],
   [
    64.76,
    11.64
   ]
  ],
  [
   [
    42.62,
    57.44
   ],
   [
    45.46,
    57.81
   ],
   [
    49.57,
    52.93
   ],
   [
    55.03,
    43.07
   ],
   [
    55.8,
    39.32
   ],
   [
    51.34,
    49.81
   ],
   [
    47.1,
    59.89
   ],
   [
    45.34,
    64.07
   ],
   [
    44.51,
    66.05
   ]
  ],
  [
   [
    42.62,
    57.44
   ],
   [
    45.46,
    57.81
   ],
   [
    33.39,
    54.92
   ],
   [
    19.91,
    51.76
   ],
   [
    17.92,
    49.17
   ],
   [
    28.7,
    36.41
   ],
   [
    38.64,
    24.65
   ],
   [
    45.85,
    16.11
   ],
   [
    37.69,
    21.51